,Name,Handle,Timestamp,Verified,Content,Comments,Retweets,Likes,Analytics,Tags,Mentions,Emojis,Profile Image,Tweet Link,Tweet ID,Unnamed: 0
0,İbrahim Yumaklı,@ibrahimyumakli,2024-02-02T12:01:20.000Z,True,"Eser ve hizmet belediyeciliğinin güzel örneklerinden Kocaeli Büyükşehir Belediyemizi ziyaret ettik.

“Gerçek Belediyecilik” vizyonuyla Kocaelili vatandaşlarımıza hizmet etmeye devam edecek ’a başarılar diliyor, misafirperverlikleri için teşekkür ediyorum.",1,4,18,218,[],['@tahirbuyukakin'],['\\U0001f4cd'],https://pbs.twimg.com/profile_images/1665808543025430528/6ivAyuED_normal.jpg,https://twitter.com/ibrahimyumakli/status/1753388128763613672,tweet_id:1753388128763613672,
1,Su Verimliliği Seferberliği,@suverimliligiTR,2024-02-02T11:19:59.000Z,True,Seferberlik sürecinde neler yapıyoruz?#SudaSıfırKayıp #SuVerimliliği,0,9,25,1.3K,"['#SudaSıfırKayıp', '#SuVerimliliği']",[],[],https://pbs.twimg.com/profile_images/1695030042525396992/DGgNwu1B_normal.jpg,https://twitter.com/suverimliligiTR/status/1753377719071518730,tweet_id:1753377719071518730,0.0
2,İbrahim Yumaklı,@ibrahimyumakli,2024-02-02T11:14:24.000Z,True,"#DünyaSulakAlanlarGünü Biyolojik çeşitlilik için büyük önem arz eden, eşsiz doğal güzelliklere sahip sulak alanlarımızı hep birlikte koruyalım.

Doğamız nefes alsın, geleceğimiz umutla filizlensin. ",2,39,100,3.6K,['#DünyaSulakAlanlarGünü'],['@milliparklar'],"['\\U0001f30d', '\\U0001f49a']",https://pbs.twimg.com/profile_images/1665808543025430528/6ivAyuED_normal.jpg,https://twitter.com/ibrahimyumakli/status/1753376315497976009,tweet_id:1753376315497976009,1.0
3,Su Verimliliği Seferberliği,@suverimliligiTR,2024-02-02T09:45:28.000Z,True,"Bakanlık olarak ülkemizdeki 16 milyon dekar alana sahip, 6 bin 418 sulak alanımıza gözümüz gibi bakarak korumaya devam ediyoruz.#SudaSıfırKayıp #SuVerimliliği",0,12,22,1.9K,"['#SudaSıfırKayıp', '#SuVerimliliği']",[],[],https://pbs.twimg.com/profile_images/1695030042525396992/DGgNwu1B_normal.jpg,https://twitter.com/suverimliligiTR/status/1753353933605466398,tweet_id:1753353933605466398,2.0
4,Su Verimliliği Seferberliği,@suverimliligiTR,2024-02-02T11:19:59.000Z,True,Seferberlik sürecinde neler yapıyoruz?#SudaSıfırKayıp #SuVerimliliği,0,9,25,1.3K,"['#SudaSıfırKayıp', '#SuVerimliliği']",[],[],https://pbs.twimg.com/profile_images/1695030042525396992/DGgNwu1B_normal.jpg,https://twitter.com/suverimliligiTR/status/1753377719071518730,tweet_id:1753377719071518730,3.0
