Link,Content
https://www.aa.com.tr/tr/gundem/istanbulun-bazi-ilcelerinde-kar-yagisi-etkili-oldu/3121773,"İstanbul .w3-content { max-width: 100%; margin: auto;} .w3-tooltip, .w3-display-container {position: relative;} .w3-black, .w3-hover-black:hover {  color: #fff!important; background-color: #000!important;} .w3-display-left { position: absolute; top: 50%; left: 0%; transform: translate(0%,-50%);-ms-transform: translate(-0%,-50%);} .w3-display-right { position: absolute; top: 50%; right: 0%; transform: translate(0%,-50%);-ms-transform: translate(0%,-50%);} .w3-btn, .w3-button {-webkit-touch-callout: none;-webkit-user-select: none; -khtml-user-select: none;-moz-user-select: none; -ms-user-select: none;user-select: none;} .w3-btn, .w3-button {border: none;display: inline-block;outline: 0;padding: 8px 16px;vertical-align: middle;overflow: hidden;text-decoration: none;color: inherit;background-color: inherit;text-align: center;cursor: pointer;white-space: nowrap;} ❮ ❯ İstanbul'da kar yağışı Pendik, Kartal, Tuzla, Sultanbeyli ve Ataşehir'de aralıklarla sulu kar yağarken Ümraniye'nin yüksek kesimleri ile Üsküdar Çamlıca Tepesi'nde kar yağışı etkisini gösterdi. Kar yağışının görüldüğü bölgelerde görüş mesafesinin de düşmesiyle sürücüler trafikte daha dikkatli araç kullandı. TEM oto yolu ve D-100 kara yolunda araç yoğunluğu meydana geldi."
https://www.aa.com.tr/tr/gundem/cumhurbaskani-erdogan-istanbul-havalimani-metrosunun-kagithane-gayrettepe-etabinin-acilisini-yapacak/3121767,"İstanbul ""Erdoğan Dijital Medya"" hesabından yapılan paylaşımda, ""Cumhurbaşkanımız Recep Tayyip Erdoğan, bugün İstanbul Havalimanı Metrosu'na ait Kağıthane-Gayrettepe etabının açılışını gerçekleştirecek."" ifadesine yer verildi. İstanbul'daki Gayrettepe-Kağıthane Metro Hattı açılıyor Paylaşımda, 9 istasyonu olan, toplamda 37,5 kilometre uzunluğa sahip metro hattının, 600 bin kişilik günlük yolcu kapasitesi bulunduğu ve metroların saatte 120 kilometre hıza ulaştığı bilgisi verildi. Cumhurbaşkanımız @RTErdogan , bugün İstanbul Havalimanı Metrosu'na ait Kâğıthane-Gayrettepe etabının açılışını gerçekleştirecek. 🚇 9 istasyon ↔️ Toplam 37,5 km uzunluk ✅ Saatte 120 kilometrelik hız 🔢 600 bin kişilik günlük yolcu kapasitesi pic.twitter.com/6GKjvHEPCB — Erdoğan Dijital Medya (@RTEdijital) January 29, 2024"
https://www.aa.com.tr/tr/gundem/yangin-sondurme-basligi-ve-dedektorler-mobilyalarla-kapatiliyor/3121762,"İstanbul Günümüzde, büyük ve kalabalık şehir merkezlerinde, 10 katı geçen veya yüksekliği 30 metreden fazla olan yüksek yapıların sayısı her geçen gün artıyor. Özellikle İstanbul, Ankara, Antalya, İzmir, Adana ve Mersin gibi büyük şehirlerde çok sayıda yüksek otel, iş merkezi ve konut bulunuyor. 30 metre sınırı, dış taraftan yangına etkin müdahale yapılacak maksimum yüksekliğin, yaklaşık bu uzunlukta olmasından kaynaklanıyor. İstanbul'da yüksek binaların sayısının her geçen gün artması akıllara, ""Bu binalarda bir yangın çıksa ne olur?"" sorusunu da getiriyor. AA muhabiri bu soruyu, TÜYAK Yönetim Kurulu Başkanı Kazım Beceren'e sordu. ""Önemli olan yönetmelikteki hususlara uyulmasıdır"" Türkiye'de bir Yangın Güvenliği Yönetmeliği bulunduğunu, yüksek binaların yönetmeliğe göre tasarlanması ve inşa edilmesinin zorunlu olduğunu belirten Beceren, 2022'deki ilk yönetmeliğin Avrupa Birliğine girme sürecinde 2007'de değiştiğini, 2015'te ise revize edildiğini kaydetti. Bu yönetmeliğin yüksek binalarda alınması gereken yangın önlemleriyle ilgili bilgileri içerdiğini aktaran Beceren, şöyle konuştu: ""Önemli olan yönetmelikte yazan hususlara uyulmasıdır. Bunu denetleyecek olan kuruluşlar; il, ilçe belediyeleri ve itfaiye teşkilatlarıdır. Fakat bu kurumların projeleri inceleme ve denetleme süreçleri çok kısa. Örneğin 51,5 metrenin üstündeki binaları denetlemek için en fazla yarım günleri var. Bu kadar kısa sürede yangın koruma sistemlerinin tamamını denetlemek, uygun şekilde çalıştığını tespit etmek mümkün değil. Ancak gözle kontrollerini yapabilirler. Bu nedenle binaların yatırımcısına, inşaat, elektrik, makine mühendisine ve mimarına büyük görev düşüyor. Bunlar işini ciddi olarak yaparsa ancak yüksek binalardaki yangın güvenliği sağlanmış olur."" Fotoğraf: Esra Bilgin/AA ""Yangın merdivenleri büyük önem taşıyor"" Türkiye'deki binaların hepsinin güvenli olduğunu söylemenin mümkün olmadığını, çıkan yangınlara, can kayıplarına ve hasarlara bakıldığında bir takım uygunsuzluk veya aksaklıkların yaşandığının görülebileceğini anlatan Beceren, bir binanın can güvenliğini sağlamanın en temel yolunun kaçış yollarının ve yangın bölgelerinin planlanmasından geçtiğini, bu anlamda yangın merdivenlerinin büyük önem taşıdığını söyledi. Bir katta çıkan yangının diğer katlara sirayet etmemesi için özellikle düşey boşlukların olması gerektiğini dile getiren Beceren, ""Buraları yangın bölgesi olarak kattaki diğer bölümlerden ayrılmalı ve uygun inşaat malzemeleri kullanılarak inşa edilmelidir. Yangın koruma, algılama, uyarı ve otomatik söndürme sistemlerinin, akredite olmuş kuruluşlar tarafından test edilip onaylanması gerekiyor."" dedi. ""İtfaiyede liyakatli kişilerin sürekliliği sağlanmalı"" Düşey boşluklarda bazen merdiven altı ürünler kullanılabildiği ve bu ürünlerin tehlikeye davetiye çıkardığına dikkati çeken Beceren, Türkiye'de belediyelere bağlı olan itfaiye teşkilatlarının, dünyada farklı bir sitemle çalıştığını da vurgulayarak, şöyle devam etti: ""Yurt dışındaki uygulamalara baktığımızda itfaiye müdürlüklerinin merkezi olması esastır. Bütün illerdeki itfaiye birimleri de bir standart oluşturmak için bu merkezi teşkilata bağlıdır. Oysa bizdeki gibi itfaiye teşkilatı ilçe belediyelerinde bağlı olduğunda A parti gidip B parti geldiğinde daire başkanlarında ve yöneticilerinde değişiklik oluyor. İtfaiye teşkilatında liyakati olan eskiden beri bu işleri yapan kişilerin sürekliliğinin sağlanması gerekir. Yatırımcılar, inşaat ve mekanik mühendisleri, her şeyi itfaiye teşkilatlarından beklememeli. Olması gereken standartlara ve yönetmeliklere zaten fazlasıyla hakimler. Bu nedenle binalar mevcut kurallara göre inşa edilsin ki biz de can güvenliğimiz sağlanmış şekilde, huzur içerisinde bu binalarda oturabilelim. Aksi takdirde sorunu çözemeyiz."" ""Toplumu bilinçlendirmek için çalışıyoruz"" Yüksek binalarında otomatik yağmurlama ve algılama uyarı sistemi gibi bir takım unsurların kurulmasının zorunlu olduğunun altını çizen Beceren, ""Vatandaş bunların ne işe yaradığını bilmediği için çoğu zaman düzgün çalışmasını gerektirecek önlemleri almıyor. Örneğin, duvar tipi bir sprinkler (sulu yangın söndürme) başlığının önüne getirip, gardırobunu koyuyor ve başlığın çalışmasını engelliyor. Yangın algılama dedektörlerini bantlarla kapatıyor. Bu nedenle ülkemizde yeterince bilinçli olduğumuzu düşünmüyorum."" dedi. Vakıf olarak Türkiye'deki yangın yönetmeliğinin 3 yılda bir revize edilmesinin öncülüğünü yaptıklarını da aktaran Beceren, ""Şu andaki yönetmeliğimiz iyi olmasına rağmen birçok maddenin yenilenmesi, değiştirilmesi gerekiyor. Bunları çeşitli sivil toplum kuruluşlarını toplayarak yapıyoruz. Sektöre yönelik biz eğitim seminerleri düzenliyoruz, çeşitli kitaplar çıkartıyoruz. Yakın zamanda yönetmelikteki ilgili bir el kitabımız çıkacak. Uluslararası sempozyumlar yapıyoruz. Bu şekilde Türkiye'de yangın konusunda toplumu bilinçlendirmek için çalışıyoruz."" diye konuştu."
https://www.aa.com.tr/tr/gundem/tuncelide-1600-jandarma-ve-polise-arama-kurtarma-egitimi/3121754,"Tunceli Kent genelinde olası afet ve acil durumlara müdahale için İçişleri Bakanlığının himayesinde, Vali Bülent Tekbıyıkoğlu'nun talimatı doğrultusunda çalışmalar yapılıyor. Deprem kuşağında yer alan şehirde, İl Emniyet Müdürlüğü ile İl Jandarma Komutanlığında görevli 1600 personele afetlerle ilgili eğitim verilmeye başlandı. İl Afet ve Acil Durum Müdürlüğü (AFAD) koordinasyonunda jandarma ve polisler, haftanın belirli günlerinde Munzur Mahallesi'nde iş makineleri desteğiyle oluşturulan enkaz sahasına geliyor. Gruplar halinde eğitimlere katılan güvenlik güçleri, Polis Arama Kurtarma (PAK) ile Jandarma Arama Kurtarma (JAK) bünyesinde çalışan uzman kişilerden dersler alıyor. Öğrendiklerini daha sonra tatbikatlarla pratiğe döken güvenlik güçleri, enkazda arama yöntemleri, arama kurtarmada kullanılan malzemeler, hasta ve yaralı taşıma teknikleri ile enkazdan yaralı çıkarma gibi konularda uzmanlaşıyor. İlk ihbardan kurtarmaya, tüm süreçleri ayrıntılı öğreniyorlar Polis Arama Kurtarma Ekip Amiri Komiser Ümit Can Erol, AA muhabirine, temel arama kurtarma eğitimlerine 15 Ocak'ta başladıklarını söyledi. Valilik koordinesinde çalışmaların devam ettiğini belirten Erol, güvenlik güçleri için 6 haftalık eğitim programı hazırladıklarını dile getirdi. Kentte görev yapan emniyet personeline dersler vereceklerini anlatan Erol, şöyle konuştu: ""Temel arama kurtarma eğitiminin içerisinde birinci modül olan sahaya giriş süreci bulunuyor. Meslektaşlarımız görev yaptıkları ilde olası bir doğal afet ya da depremde ilk ihbarı aldıktan sonra meydana gelen krizi yönetecekler ve sahaya giriş süreçleri belirleyecekler. İkinci modül de ise eğitim alan meslektaşlarımız sahaya giriş tekniklerini yerine getirdikten sonra kazazedeye veya yaralıya ulaşma yöntemlerini saptayacaklar. En son olarak da kazazedeyi bulunduğu yerden tahliye etmek üzere çalışma yürütecekler."" Erol, güvenlik güçlerinin eğitimlere özveriyle katıldığını belirterek, ""Personelimiz bu eğitimlerin sonunda olası bir depremde kentsel arama kurtarma anlamında profesyonel ekiplerle koordineli şekilde çalışacak ve elinde bulunan malzemeleriyle olaya doğrudan müdahale edebilecektir."" dedi."
https://www.aa.com.tr/tr/gundem/milli-savunma-bakani-guler-kosovali-mevkidasi-maqedonci-ile-gorustu/3121746,"Ankara Bakan Güler, Kosovalı mevkidaşı Maqedonci'yi Milli Savunma Bakanlığında resmi törenle karşıladı. Ülke marşlarının çalınmasının ardından konuk Maqedonci, onur kıtasını selamladı. İki bakan törenin ardından görüşme gerçekleştirdi."
https://www.aa.com.tr/tr/gundem/hollandada-islami-kuruluslardan-kuranin-tahrip-edilmesinin-yasaklanmasi-icin-eylem-plani/3121729,"Rotterdam K7 olarak adlandırılan, yaklaşık 200 caminin üyesi olduğu yedi İslami kuruluş platformu, hukuk uzmanları ile birlikte Avrupa ve Hollanda yasalarına göre gösterilerde Kur’an-ı Kerim’in tahrip edilmesinin yasaklanmasına yön gösteren ve tarif eden eylem planı hazırladı. Kur’an-ı Kerim’in gösterilerde tahrip edilmesinin din özgürlüğüne aykırı olduğu gerekçesiyle hazırlanan ve 5 maddeden oluşan eylem planı, K7 yetkilileri tarafından Hollanda Belediyeler Birliği (VNG) ve Belediye Başkanları Derneğine (NGB) gönderildi. Belediye başkanları ve meclis üyeleri için hazırlanan planda, Kur'an'a saygısızlık içeren bir gösteri için başvurulduğu andan itibaren ilgili taraflarla sürekli temas halinde olunması, gösteri hakkı ile Kur’an’ın yakılması ve tahrip edilmesi gibi saygısız eylemlerin arasındaki farkın ayırt edilmesi, din özgürlüğü ve benzeri hakları içeren temel hakların değerlendirilmesi, dini huzurun korunması ve nefrete teşvikin önlenmesi tarif ediliyor. İslami kuruluşlar uygulanmasını istedikleri plan ile toplumda daha fazla uyum ve huzurun ifade özgürlüğü çerçevesinde netliğin sağlanmasını amaçlıyor. Rijnmond İslami Kuruluşlar Platformu (SPIOR) Müdürü Nourdin el Ouali, AA muhabirine yaptığı açıklamada, ırkçı ve aşırı sağcı Batı'nın İslamlaşmasına Karşı Vatansever Avrupalılar (PEGIDA) hareketi lideri Edwin Wagensveld'in farklı kentlerde yaptığı Kur'an-ı Kerim'e saldırı eylemlerinin provokatif, aşağılayıcı ve tahrik etme amaçlı olduğunu söyledi. Wagensveld’in Kur'an-ı Kerim'e saldırı eylemlerini ifade özgürlüğü alanını kullanarak yaptığını belirten Ouali, ""Tek soru ve tartışma, bunun ifade özgürlüğü kapsamına girip girmediğidir. Bizim düşüncemize göre değil. Şu anda hükümetimizin görüşüne göre giriyor. Genel olarak Tanrı'nın Hollanda'da artık kutsal olmadığını söyleyebiliriz ancak bu ülkede birçok şey hala kutsaldır."" dedi. Ouali, “Hollanda'ya ders vermek için gelmek isteyen bir imamın antidemokratik olduğu söylentiler dışında görünürde hiçbir neden yokken ülkeye girişi yasaklandı. Çok tuhaf ama buraya gelmeden önce Hollanda'ya gelmesini yasakladılar ve dolayısıyla ifade özgürlüğünü kısıtladılar. Yani birçok noktada gerçekten çifte standart uygulandığını görüyoruz. Bu düşündürücü. Aynı zamanda insanlar hükümetin giderek daha az güvenilir ve taraflı olduğunu düşünüyor.” ifadesini kullandı. Hollanda'da yasalarla ""din özgürlüğü""nün korunduğunu vurgulayan Ouali, buna rağmen uygulanmamasındaki nedenin ülkede İslam karşıtı sempatizanlara çok fazla destek verildiğini ve bunun sorun olarak görülmediğini düşündüğünü dile getirdi. Ouali, yaklaşık 200 caminin üyesi olduğu, SPIOR’un da içinde bulunduğu yedi İslami kuruluş platformunun, gösterilerde Kur’an-ı Kerim’in tahrip edilmesini engelleyen bir eylem planı hazırladıklarını belirterek, şunları kaydetti: “Avrupa ve ulusal hukuku temel alan kanundaki maddelerin bu konuda ne söylediğini, bunun mümkün olup olmadığını veya gerçekten herhangi bir sınırlama olup olmadığını araştırmak için Avrupa hukukunu ve ulusal hukuku temel alan bir eylem planı geliştirildi. Nihai sonuca ulaştık ve aslında bunu kanıtladık. Bu eylem planı, belediye başkanları ve belediye meclis üyeleri için hazırlandı. Aslında bu plan sayesinde, dini huzuru korumak ve kutuplaşmayı önlemek için gösterilerde Kuran'ın yakılmasını erken bir aşamada yasaklamak yeterlidir. Eylem planını VNG ve NGB’ye gönderdik.” Eylem planı henüz uygulanmasa da gündem oluşturduğuna ve medya aracılığı ile kamuoyuna yansıdığına vurgu yapan Ouali, şöyle devam etti: “Bunun (gösterilerde Kur’an-ı Kerim’in tahrip edilmesinin yasaklanması) hemen uygulanacağını düşünmüyorum ancak bunun bir başlangıç ​​olduğunu düşünüyorum. Avrupa'da tanrı kutsal değil ama ekonomi kutsaldır. Belki de şu an için insanların anladığı tek dil budur. Dolayısıyla uluslararası boykot tehdidinde bulunulduğunda ya da gerçekten ulusal ekonomi açısından olumsuz sonuçları olduğunda yetkililer bu yasağı uygulamaya hazır olabilir. Yani kanunlarınız olabilir ama insanlar harekete geçmezse hiçbir şey değişmez. Bu aynı zamanda her vatandaş için bir yükümlülüktür.” Ouali, eylem planını sürekli gündemde tutup dikkati çekerek, uzun vadede gösterilerde Kur’an-ı Kerim’in tahrip edilmesinin yasaklanmasına katkı sağlayacağına inandığını belirtti."
https://www.aa.com.tr/tr/gundem/kayak-merkezlerinde-en-fazla-kar-kalinligi-205-santimetreyle-hakkaride-olculdu/3121660,"Kastamonu Meteoroloji Genel Müdürlüğü verilerinden derlenen bilgilere göre, kayak merkezlerindeki kar kalınlığı, Hakkari'de 205, Kartalkaya'da 175, Palandöken'de 170, Sarıkamış'ta 159, Palandöken 2'de 135, Ergan'da 129, Uludağ'da 76, Keltepe'de 70, Erciyes'te 66, Haserek'te 52, Çambaşı'nda 49, Ilgaz ve Yalnızçam'da 41, Mersivan'da 35, Zigana'da 34, Kop'ta 31, Abalı ve Yıldıztepe'de 30, Yıldız Dağı'nda 25, Yedi Kuyular ve Elmadağ'da 13, Denizli ve Murat Dağı'nda 11 santimetre ölçüldü. Bazı kayak merkezlerinde en düşük ve en yüksek hava sıcaklık tahminleri ise şöyle: Merkez 29.01.2024 En düşük En yüksek Hakkari KY -15 -7 Kartalkaya KY -14 -7 Sarıkamış HKY -18 -6 Palandöken ÇB -15 -9 Ergan ÇB -14 -7 Erciyes ÇB -15 -6 Kartepe KY -5 -4 Uludağ KY -8 -3 Çambaşı KY -8 -4 Yıldıztepe KY -9 -4 Mersivan ÇB -6 -2 Yalnızçam ÇB -22 -7 Ilgaz KY -11 -5 Yıldız Dağı KY -9 -3 Zigana KY -13 -5 Kop ÇB -17 -7 Denizli ÇB -10 -4 (KY: Kar yağışlı, HKY: Hafif kar yağışlı, ÇB: Çok bulutlu)"
https://www.aa.com.tr/tr/gundem/turkiye-ve-dunya-gundemi/3121620,"Ankara 1- Cumhurbaşkanı Recep Tayyip Erdoğan, İstanbul Havalimanı Metrosu Kağıthane-Gayrettepe Etabı Açılış Töreni'ne katılacak. (İstanbul/12.00) (Fotoğraflı-Görüntülü) 2- TBMM Başkanı Numan Kurtulmuş, resmi ziyareti çerçevesinde Bahreyn Temsilciler Meclisi Başkanı Ahmed Al Musalam, Şura Meclisi Başkanı Ali bin Saleh Al Saleh, Veliaht Prens ve Başbakan Selman bin Hamed İsa Al Halife ve Kral Hamed bin İsa Al Halife ile ayrı ayrı görüşecek. (Manama) (Fotoğraflı-Görüntülü) YASAMA YÜRÜTME SİYASET 1- İYİ Parti Genel Başkanı Meral Akşener, partisinin il başkanlığını ziyaret edecek, esnafla görüşecek, teşkilat buluşmasına katılacak, Gülyalı ilçesine bağlı Turnasuyu köyüne gidecek. (Ordu/12.30/13.15/15.30/17.00) (Fotoğraflı-Görüntülü) EKONOMİ FİNANS 1- Türkiye İstatistik Kurumu, 2023 yılı gelir dağılımı istatistiklerini açıklayacak. (Ankara/10.00) DÜNYA DİPLOMASİ 1- Dışişleri Bakanı Hakan Fidan, Arnavut mevkidaşı İgli Hasani ile görüşecek, Arnavutluk Başbakanı Edi Rama ve Cumhurbaşkanı Bajram Begaj tarafından kabul edilecek. (Tiran) (Fotoğraflı-Görüntülü) 2- İsrail'in abluka altındaki Gazze Şeridi'ne saldırıları ve insani krize ilişkin gelişmeler takip ediliyor. (Kudüs/Gazze/Kahire) (Fotoğraflı-Görüntülü) SPOR 1- Trendyol Süper Lig'in 23. haftası; Mondihome Kayserispor-Bitexen Antalyaspor, İstanbulspor-Yılport Samsunspor, Galatasaray-Gaziantep FK ve Trabzonspor-Kasımpaşa maçlarıyla tamamlanacak. (Kayseri/17.00/İstanbul/17.00/20.00/Trabzon/20.00) (Fotoğraflı-Görüntülü) 2- Trendyol 1. Lig'in 20. haftası, Astor Enerji Şanlıurfaspor-Boluspor karşılaşmasıyla sona erecek. (Şanlıurfa/20.00) (Fotoğraflı) 3- Türkiye Sigorta Basketbol Süper Ligi'nin 18. haftası, Onvo Büyükçekmece Basketbol-Darüşşafaka Lassa maçıyla tamamlanacak. (İstanbul/19.00) (Fotoğraflı) 4- Voleybol Vodafone Sultanlar Ligi'nin 18. haftasında Karayolları-Aydın Büyükşehir Belediyespor maçı yapılacak. (Ankara/15.00) (Fotoğraflı)"
https://www.aa.com.tr/tr/gundem/kahramanlar-47-operasyonunda-159-kilogram-patlayici-madde-ele-gecirildi/3121611,"Ankara İçişleri Bakanı Ali Yerlikaya, bölücü terör örgütü (BTÖ) mensubu teröristlerin kırsalda kış aylarında eylem yapmak amacıyla 7 ilde mağara ve sığınaklara sakladıkları çeşitli silah, mühimmat ve patlayıcıların yok edilmesine yönelik gerçekleştirilen Kahramanlar 47 Operasyonu'nda 28 barınma alanının imha edildiğini, çok sayıda roketatar, el bombası ve 159 kilogram patlayıcı maddenin ele geçirildiğini bildirdi. Bakan Yerlikaya, sosyal medya hesabından yaptığı açıklamada, Mardin, Bitlis, Şırnak, Batman, Siirt, Tunceli ve Diyarbakır'da, Dargeçit, Nusaybin, Beytüşşebap, Kozluk, Sason, Dicle, Lice, Silvan, Eruh, Mazgirt ve Cizre kırsalında düzenlenen operasyonun 131 tim, 1174 jandarma özel harekat, komando ve güvenlik korucularıyla J-SİHA- ATAK helikopterlerinin katılımıyla gerçekleştirildiğini belirtti. Operasyonlarda patlamaya hazır hale getirilmiş, düzenekleri kurulmuş 159 kilogram patlayıcı maddenin ele geçirildiğinin bilgisini veren Yerlikaya, şunları kaydetti: ""5 RPG-7 roketatar, 8 el bombası, EYP düzenekleri, zagros keskin nişancı tüfeği, 3 AK-47 piyade tüfeği, av tüfeği, 12 piyade tüfeği şarjörü, 267 mühimmat, 9 elektronik devre kartı, 30 el telsizi, optik cihaz, el dürbünü, 4 akü, 25 tüple çok sayıda örgütsel doküman, mutfak, sağlık ve yaşam malzemeleri ele geçirildi."" Bakan Yerlikaya, terör örgütünün kış aylarında lojistik amaçlı kullanmak ve eylem yapmak için hazırladığı inlerin tek tek tespit edilip başlarına yıkıldığını vurgulayarak, ""Yılın 365 günü, 4 mevsim, 12 ay, gece gündüz demeden terör örgütlerine operasyonlar düzenliyoruz. Terörle mücadelemiz son terörist etkisiz hale getirilinceye kadar kararlılıkla devam edecek. Milletimizin duası bizimle."" ifadelerini kullandı."
https://www.aa.com.tr/tr/gundem/istanbulda-kar-bazi-cadde-ve-sokaklari-beyaza-burudu/3121573,"İstanbul Meteoroloji Genel Müdürlüğünün yaptığı uyarıların ardından akşam saatlerinde Fatih, Çatalca ve Silivri'de kar yağışı başladı. Mega kentin bazı bölgelerinde yağış nedeniyle cadde ve sokaklar beyaza büründü. Çatalca'da ise yoğun kar yağışı nedeniyle bazı araçların yolda kaldığı öğrenildi."
https://www.aa.com.tr/tr/gundem/santa-maria-kilisesindeki-silahli-saldirinin-failleri-yakalandi/3121507,"İstanbul/Ankara İstanbul Emniyet Müdürlüğü Terörle Mücadele Şube Müdürlüğü ile asayiş ve ilçe emniyet ekipleri, Büyükdere Mahallesi'ndeki Santa Maria Kilisesi'nde ayin sırasında yapılan silahlı saldırının şüphelilerinin yakalanmasına yönelik çalışma başlatmıştı. Cumhurbaşkanı Erdoğan'dan, Santa Maria Kilisesi cemaatine başsağlığı telefonu Bakan Yerlikaya'dan, Santa Maria Kilisesi'nde meydana gelen silahlı saldırıya ilişkin açıklama Bu sabah Sarıyer Santa Maria Kilisesinde Pazar ayini sırasında Tuncer Cihan isimli vatandaşımızın ölümüne neden olan 2 katil zanlısı yakalanmıştır.❗️ Failleri tespit edip yakalayan İstanbul Emniyetimizi ve kahraman polislerimizi tebrik ediyorum. Hayatını kaybeden vatandaşımızın… — Ali Yerlikaya (@AliYerlikaya) January 28, 2024 İçişleri Bakanı Yerlikaya, Santa Maria Kilisesi'ndeki saldırıya ilişkin açıklama yaptı İçişleri Bakanı Ali Yerlikaya, kilisedeki pazar ayini sırasında maskeli iki kişi tarafından düzenlenen, bir kişinin ölümüyle sonuçlanan silahlı saldırının ardından yürütülen operasyonlara ilişkin İstanbul Emniyet Müdürlüğü'nde açıklamalarda bulundu. Olayın hemen ardından yaptıkları açıklamada faillerin kısa sürede yakalayacaklarını kaydettiklerini anımsatan Yerlikaya, İstanbul Emniyetinin hızlı ve kapsamlı bir çalışma başlattığını aktardı. Yerlikaya, ""Gün boyu emniyet güçlerimiz 30 ayrı adrese baskın düzenledi ve şu ana kadar 47 şahıs gözaltına alındı. Son olarak ise saat 22.00'de belirlenen adrese yapılan baskında cinayet zanlısı her iki şahıs da yakalandı. Zanlıların her ikisinin de yabancı uyruklu olduğunu ifade etmek istiyorum. Biri Tacikistanlı, diğeri Rusyalı olan bu iki yabancı uyruklunun DEAŞ'lı olduklarını değerlendiriyoruz. Olayın üzerinden 12 saat bile geçmeden her iki katil zanlısını yakalayan İstanbul Emniyetimize, kahraman polislerimize teşekkür ediyorum."" diye konuştu. Bakan Yerlikaya, kilisede işlenen cinayetle ilgili zanlıların ifadelerinin alınacağını, olayla ilgili karanlık noktaların aydınlatılacağını söyledi. ""Biz, Türkiye'nin huzuru diyoruz."" Medeniyetin baş tacı İstanbul'un farklı dinlere ve mezheplere asırlardır ev sahipliği yaptığını, yapmaya da devam edeceğini vurgulayan Yerlikaya, ""Biz, Türkiye'nin huzuru diyoruz. Ülkemizin huzurunu bozmaya çalışanlara, teröristlere ve onların işbirlikçilerine ulusal olsun, uluslararası olsun suç odaklarına, birlik ve beraberliğimize kastedenlere asla ama asla göz açtırmayacağız. Hayatını kaybeden vatandaşımıza, ailesine ve yakınlarına bir kez daha başsağlığı diliyorum."" ifadelerini kullandı. Bakan Yerlikaya, başta bölücü terör örgütü olmak üzere terörün her türlüsüyle azimle ve kararlılıkla mücadele ettiklerini aktararak, terör örgütü DEAŞ'a yönelik 1 Haziran 2023'ten bugüne kadar toplam 1046 operasyon yaptıklarını, gözaltına alınan 2 bin 86 şüpheliden 529'unun tutuklandığını, 404'ü hakkında ise adli kontrol kararı alındığını bildirdi. #Canlı : İçişleri Bakanı Ali Yerlikaya, Santa Maria Kilisesi'ndeki silahlı saldırının faillerinin yakalanmasına ilişkin açıklama yapıyor https://t.co/MqMN2pOVcL — AA Canlı (@AACanli) January 28, 2024"
